{
  "$schema": "../../schemas/task.schema.json",
  "id": "d3.binary.macos_libpath",
  "dimension": "D3",
  "title": "No hard-coded macOS-only backend path",
  "fixture": "fixtures/d3/macos_libpath.fixture.json",
  "call": {
    "argv": [
      "convert",
      "--to",
      "pdf",
      "report.odt",
      "--json"
    ]
  },
  "assert": [
    {
      "kind": "stdout_not_contains",
      "value": "/Applications/LibreOffice.app/Contents/MacOS"
    }
  ],
  "points": 4,
  "provenance": "HKUDS/CLI-Anything#221"
}