{
  "$schema": "../../schemas/task.schema.json",
  "id": "d2.repl.banner_signature",
  "dimension": "D2",
  "title": "Startup must not crash with a banner TypeError",
  "fixture": "fixtures/d2/repl_banner_signature.fixture.json",
  "call": {
    "argv": [
      "version",
      "--json"
    ]
  },
  "assert": [
    {
      "kind": "exit_code",
      "equals": 0
    },
    {
      "kind": "stdout_not_contains",
      "value": "Traceback"
    },
    {
      "kind": "never_prompted"
    }
  ],
  "points": 3,
  "provenance": "HKUDS/CLI-Anything#278"
}